scenario,goal1,goal2
Selling a Used Laptop,(Buyer) Goal: Target price is $700. Aiming to purchase the used laptop for a price significantly lower than the market value to stay within budget.,(Seller) Goal: Target price is $850. Wants to sell the laptop for a price higher than the initial purchase cost to make a profit.
Renting an Apartment,(Renter) Goal: Target rent is $1200 per month. Hoping to negotiate a lower rent to save money for other expenses.,(Landlord) Goal: Target rent is $1500 per month. Looking to rent out the apartment for a price that covers expenses and provides a reasonable profit margin.
Buying a Used Car,(Buyer) Goal: Target price is $8000. Wanting to purchase the used car for a significantly lower price to fit within a tight budget.,(Seller) Goal: Target price is $9500. Hoping to sell the car for a price higher than its depreciated value to maximize profit.
Purchasing Concert Tickets,(Buyer) Goal: Target price is $100 per ticket. Looking to buy concert tickets for a reasonable price to attend with friends without overspending.,(Seller) Goal: Target price is $120 per ticket. Trying to sell the concert tickets for a price that reflects their demand and popularity.
Negotiating Freelance Services,(Client) Goal: Target price for the freelance service is $500. Wanting to hire a freelancer for a project within a specific budget constraint.,"(Freelancer) Goal: Target price for the freelance service is $700. Seeking to charge a rate that compensates for time, effort, and expertise invested in the project."
Leasing Office Space,(Lessee) Goal: Target rent is $2000 per month. Aims to secure a prime location for their startup while keeping overhead costs manageable.,(Lessor) Goal: Target rent is $2500 per month. Intends to lease the property at a competitive rate that reflects the market value and location benefits.
Selling Handmade Jewelry Online,"(Buyer) Goal: Target price is $50. Wants to purchase unique, quality handmade jewelry without exceeding a personal spending limit.",(Seller) Goal: Target price is $75. Strives to earn a fair profit from craftsmanship and artistic value.
Buying Organic Produce in Bulk,"(Restaurant Owner) Goal: Target price is $300 for the bulk order. Seeks to source fresh, organic produce at a lower cost to enhance menu offerings.",(Farmer) Goal: Target price is $350 for the bulk order. Aiming to sell organic produce at a price that justifies the sustainable farming methods used.
Commissioning a Custom Art Piece,(Art Collector) Goal: Target price is $2000. Desires a custom art piece from a renowned artist at a price that reflects the perceived value.,"(Artist) Goal: Target price is $2500. Wants to be compensated fairly for the time, creativity, and materials involved in creating a unique piece."
Renting Designer Dresses,(Customer) Goal: Target rent is $100 per dress. Looking to rent high-end designer dresses for special occasions without buying.,(Rental Service) Goal: Target rent is $150 per dress. Aims to provide a luxury experience while maintaining a high turnover on investment pieces.
Subletting a Vacation Home,(Subletter) Goal: Target price is $500 per week. Wishes to find a cost-effective vacation home for a family holiday.,(Homeowner) Goal: Target price is $600 per week. Seeks to sublet the vacation home at a rate that covers maintenance costs and generates income.
Purchasing Fitness Equipment,"(Gym Owner) Goal: Target price is $10,000. Aiming to equip a new gym with high-quality fitness gear within a strict budget.","(Equipment Supplier) Goal: Target price is $12,000. Looking to sell a comprehensive gym setup at a competitive market price."
Acquiring Rare Books,(Collector) Goal: Target price is $500 for a rare edition. Hopes to expand personal library with rare finds at reasonable prices.,(Bookseller) Goal: Target price is $700 for the rare edition. Intends to capitalize on the rarity and condition of the book to maximize returns.
Hiring IT Support Services,(Small Business Owner) Goal: Target price is $1000 per month. Needs reliable IT support to maintain operations smoothly and cost-effectively.,(IT Service Provider) Goal: Target price is $1200 per month. Strives to offer comprehensive support services that justify the pricing through quality and responsiveness.
Licensing Music for Commercial Use,(Advertiser) Goal: Target price is $2000 for the license. Seeks to use popular music to enhance a marketing campaign without overextending the budget.,(Music Producer) Goal: Target price is $2500 for the license. Aims to profit from licensing music while ensuring fair compensation for artistic work.
Opening a Coffee Shop,(Lessee) Goal: Target rent is $2500 per month. Aims to find a location with high foot traffic.,(Lessor) Goal: Target rent is $3000 per month. Seeks to lease to reliable tenants at a competitive market rate.
Selling Custom-Made Bicycles,"(Buyer) Goal: Target price is $800. Wants a high-quality, durable bicycle.",(Seller) Goal: Target price is $950. Aims to earn a fair profit from specialized craftsmanship.
Launching a Mobile App,(Developer) Goal: Budget is $20000 for development. Seeks cost-effective programming talent.,(Investor) Goal: Investment of $25000. Expects robust functionality and potential for high user engagement.
Organizing a Music Festival,(Organizer) Goal: Budget is $100000. Wants to secure popular bands and ensure high ticket sales.,(Sponsor) Goal: Contribution of $120000. Expects prominent branding and access to VIP areas.
Starting an Organic Farm,(Farmer) Goal: Target lease is $1500 per acre per year. Looks for fertile land with good water access.,(Landowner) Goal: Target lease is $1700 per acre per year. Wants to support sustainable practices while maximizing income.
Opening a Bookstore,(Owner) Goal: Target rent is $2000 per month. Seeks a cozy location that attracts literature enthusiasts.,(Property) Manager Goal: Target rent is $2200 per month. Aims to find stable tenants who enhance the neighborhood's cultural value.
Selling Limited Edition Art Prints,"(Buyer) Goal: Target price is $200 per print. Desires unique, high-quality art for collection.",(Artist) Goal: Target price is $250 per print. Intends to be compensated for artistic value and exclusivity.
Renting Out Co-Working Spaces,"(Lessee) Goal: Target rent is $400 per desk per month. Needs a modern, well-equipped space.",(Lessor) Goal: Target rent is $450 per desk per month. Wants to offer competitive amenities while maintaining profitability.
Distributing Imported Cheese,(Retailer) Goal: Target purchase price is $10 per pound. Seeks to offer gourmet products at competitive prices.,(Distributor) Goal: Target sale price is $12 per pound. Aims to cover import costs and achieve a sustainable margin.
Buying a Professional Camera,(Buyer) Goal: Target price is $1500. Wants high-resolution images and durability.,(Seller) Goal: Target price is $1700. Aims to provide expert advice and post-sale support to justify the premium.
Leasing Luxury Retail Space,(Retailer) Goal: Target rent is $5000 per month. Seeks prime location to attract high-end clientele.,(Property Owner) Goal: Target rent is $5500 per month. Aims to lease to prestigious brands that enhance property value.
Selling Handcrafted Pottery,"(Buyer) Goal: Target price is $30 per item. Looks for unique, functional art pieces.",(Potter) Goal: Target price is $40 per item. Seeks fair compensation for time and creativity.
Launching a Fitness Studio,(Owner) Goal: Target rent is $3000 per month. Desires a spacious area in a health-conscious community.,(Landlord) Goal: Target rent is $3500 per month. Looks for long-term tenants with a solid business plan.
Renting Designer Wedding Dresses,(Bride) Goal: Target rent is $800. Wants a luxurious gown without the full purchase price.,(Boutique) Goal: Target rent is $1000. Aims to provide exclusive designs and personal fitting services.
Buying a Small Yacht,(Buyer) Goal: Target price is $30000. Seeks a well-maintained vessel for leisure sailing.,(Seller) Goal: Target price is $35000. Intends to justify the price with the yacht's features and upkeep.
Starting a Vegan Restaurant,(Owner) Goal: Target rent is $4000 per month. Looks for a trendy location appealing to a health-focused clientele.,(Property Owner) Goal: Target rent is $4500 per month. Seeks to lease to innovative concepts that attract regular customers.
Selling Gourmet Chocolates,(Buyer) Goal: Target price is $15 per box. Desires artisanal quality for gift-giving.,(Chocolatier) Goal: Target price is $20 per box. Wants to be recognized for unique flavors and premium ingredients.
Launching an Online Art Gallery,"(Curator) Goal: Budget is $15,000 for website development. Seeks to balance visual appeal with cost-efficiency.","(Investor) Goal: Investment of $20,000. Expects a high ROI and sustainable profit margins."
Starting a Specialty Tea Shop,(Owner) Goal: Target rent is $2200 per month. Seeks affordability in a high foot-traffic area to maximize customer reach.,(Landlord) Goal: Target rent is $2500 per month. Aims for long-term tenancy with financially stable businesses.
Selling Eco-Friendly Apparel,(Buyer) Goal: Target price is $45 per item. Seeks products priced sustainably to balance cost and quality.,(Seller) Goal: Target price is $55 per item. Aims to cover production costs while achieving a competitive market rate.
Creating a Vegan Cooking Channel,"(Content Creator) Goal: Budget is $5,000 for initial setup and marketing. Focuses on maximizing budget efficiency to enhance online visibility.","(Sponsor) Goal: Contribution of $7,000. Expects a strategic investment return through high viewer engagement."
Renting Antique Furniture for Events,(Event Planner) Goal: Target rent is $300 per event. Seeks unique pieces that offer visual appeal at budget-friendly rates.,(Furniture Owner) Goal: Target rent is $400 per event. Aims for profitability while maintaining competitive pricing.
Developing a Language Learning App,"(Developer) Goal: Budget is $30,000 for app development. Plans to include cost-effective features for faster ROI.","(Angel Investor) Goal: Investment of $35,000. Expects the app to achieve market penetration and generate sustainable profits."
Opening a Craft Brewery,(Brewer) Goal: Target lease is $4500 per month. Seeks a trendy location that balances cost with potential customer traffic.,(Property Owner) Goal: Target lease is $5000 per month. Focuses on attracting businesses that boost property value and ensure steady income.
Selling Handmade Soaps,(Buyer) Goal: Target price is $10 per bar. Looks for quality products at a price that reflects the value.,(Artisan) Goal: Target price is $12 per bar. Aims to earn fair compensation for craftsmanship within market expectations.
Launching a Freelancer Hub Website,"(Web Developer) Goal: Budget is $20,000 for a robust platform. Strives for an economical build that maximizes user connectivity.","(Venture Capitalist) Goal: Investment of $25,000. Expects a scalable platform with a clear profitability path."
Buying Exotic Plants Online,(Buyer) Goal: Target price is $35 per plant. Wants rare plants at prices justified by their uniqueness and quality.,(Seller) Goal: Target price is $45 per plant. Aims to ensure a healthy profit margin while providing well-maintained plants.
Starting a Mobile Pet Grooming Service,"(Owner) Goal: Budget is $10,000 for a grooming van setup. Plans to offer competitive pricing to penetrate the market quickly.","(Investor) Goal: Investment of $12,000. Expects rapid market entry and a strong customer base to ensure quick returns."
Opening a Boutique Hotel,(Hotelier) Goal: Target lease is $8000 per month. Seeks a distinctive property that supports premium pricing.,(Property Owner) Goal: Target lease is $8500 per month. Aims to secure high-value tenants that enhance the property's prestige.
Selling Digital Art NFTs,(Artist) Goal: Target price is $500 per NFT. Seeks to capitalize on digital trends while ensuring artistic value translates to digital revenue.,(Collector) Goal: Target price is $550 per NFT. Looks for investment in art with potential for appreciation.
Launching a Health and Wellness Podcast,"(Host) Goal: Budget is $3,000 for initial episodes. Focuses on cost-effective production to maximize outreach and sponsorship appeal.","(Sponsor) Goal: Contribution of $5,000. Expects brand enhancement and a solid return through targeted audience engagement."
Renting High-End Camera Equipment,(Photographer) Goal: Target rent is $200 per day. Needs to balance high-quality equipment with budget constraints.,(Rental Service) Goal: Target rent is $250 per day. Aims to offer competitive rates while ensuring equipment is top-notch and well maintained
Selling Imported Luxury Watches,(Buyer) Goal: Target price is $2000 per watch. Seeks exclusivity at a price that reflects the watch's value and rarity.,(Importer) Goal: Target price is $2200 per watch. Strives for a profit margin that justifies the exclusivity and demand of the product.
Starting a Street Food Market,"(Organizer) Goal: Budget is $5000 for initial setup. Plans to create a cost-effective, vibrant space for vendors and consumers.","(City Council) Goal: Licensing fee of $5500. Expects to enhance local food culture and attract tourists, generating city revenue."
Selling Organic Baby Food Online,"(Parent) Goal: Target price is $15 per pack. Seeks nutritious, organic options at fair market prices.",(Producer) Goal: Target price is $18 per pack. Aims to cover costs of organic ingredients and sustainable packaging while maintaining a competitive edge.
